id,type,rooms,bathrooms,squaremeters,floor,furnished,image,description,price,typenum,furnishednum,transport,equipped,renovated,shops,cellar,balcony,parking,shared,green,historic,university
81,apartment,3,1,61,2,no,html/img/houses/81.JPG,"Residence very close to the city center of Rennes (10 minutes) located in a quiet and residential area with high-end services. Close to shops, CHR transport and the St Laurent clinic. Very nice 3-room apartment of 61.26 m² located on the 2nd floor with lift, west exposure. It consists of an entrance with cupboard, a fitted kitchen (worktop, storage, hob, extractor) open to a large living room giving access to a large 15.5 m² balcony, two bedrooms with parquet on the ground, a bathroom (vanity unit, mirror, shower) and separate WC.",715,3,0,1,0,0,1,0,1,0,0,0,0,0
82,studio,1,0,14,3,yes,html/img/houses/82.JPG,SMALL FURNISHED STUDIO WITH A SURFACE OF 14 M2 COMPRISING A MAIN ROOM WITH KITCHENETTE AREA - A SHOWER ROOM - COMMON WC ON THE LANDING VERY QUIET - GARDEN SIDE.,425,2,1,1,0,0,1,0,0,0,1,1,0,0
83,apartment,2,1,30,3,yes,html/img/houses/83.JPG,"Close to the city center, in a quiet and secure residence, an apartment with balcony and parking space, comprising an entrance hall, a fitted kitchen, a living room with a bedroom area, a bathroom.",540,3,1,1,0,0,1,0,1,1,0,0,0,0
84,apartment,4,1,78,0,yes,html/img/houses/84.JPG,"In the foot of the future Gayeulles metro station and shops, very beautiful furnished T4 of 78.88m² in a 2010 residence. On the ground floor, it offers: entrance with cupboard, beautiful living room opening onto a balcony of 5.63 m² facing south, open kitchen, corridor, 3 bedrooms with cupboards, bathroom and separate WC. Closed garage in secure basement and aerial parking space. Furniture. Living area: 78.88 m². ",1385,3,1,1,0,1,1,0,1,1,0,0,0,0
85,studio,1,0,12,1,yes,html/img/houses/85.JPG,"Flatshare 2 furnished rooms with balcony, shared, in a T5 apartment with 3 other flatmates. Common rooms: hallway, fitted and equipped kitchen, large bathroom with washing machine and dryer, separate wc.",380,2,1,0,1,0,0,0,1,0,1,0,0,0
86,apartment,3,1,70,2,yes,html/img/houses/86.JPG,"Apartment located on the 2nd floor of a 1998 building, comprising an entrance hall, a living room opening onto a south-west facing terrace, a fitted and equipped kitchen, a utility room, 2 bedrooms, one with a closet, a bathroom and a separate WC. Individual heating (recent radiators), PVC double glazing, bicycle storage and fiber optics. Cellar and private parking in the secure basement. ",850,3,1,0,1,0,0,1,1,1,0,0,0,0
88,apartment,2,1,39,3,yes,html/img/houses/88.JPG,"Very nice furnished T2 of 39m2 rue d'Antrain in a small building 2 minutes walk from the Saint Anne metro station. Composed of a kitchen entrance, large separate living room, bedroom, bathroom (shower) and separate WC.",725,3,1,1,0,0,1,0,0,0,0,0,0,0
89,apartment,2,1,59,1,no,html/img/houses/89.JPG,"On the 1st floor of a charming condominium, we offer a furnished one-bedroom apartment with a surface area of ​​58m2 located at 4 bis Rue la Motte Picquet in RENNES and close to all amenities. It consists of an entrance, a fitted kitchen, a living room with fireplace, a bedroom with closet and a bathroom with WC and storage.",835,3,0,1,0,0,1,0,0,0,0,0,0,0
92,apartment,2,1,29,9,yes,html/img/houses/92.JPG,"Very nice T2 of 29m2 on the 9th floor with elevator. The apartment is bright thanks to its large bay window, has been renovated and tastefully furnished. It is composed of a large living room/dining room open to the fully equipped kitchen and a bedroom with its bathroom. ",630,3,1,0,1,1,0,0,0,0,0,0,0,0
93,apartment,2,1,41,3,yes,html/img/houses/93.JPG,"Apartment on the 3rd floor of a small collective, refurbished, with fitted kitchen, furnished bedroom, living room, shower room with wc and washing machine. Fully equipped kitchen with Nespresso, dishwasher, fridge/freezer, oven, microwave, crockery, kitchen utensils, frying pans, saucepans.",850,3,1,0,1,1,0,0,0,0,0,0,0,0
94,studio,1,1,24,5,yes,html/img/houses/94.JPG,"In the heart of the city center. Duplex studio on the top floor in a quiet secure building. Comprising a main room with kitchen area, bedroom on the mezzanine, bathroom. ",500,2,1,1,0,0,1,0,0,0,0,0,0,0
96,apartment,3,1,58,2,no,html/img/houses/96.JPG,"In recent residence, Type 3 of 58 m² on the 2nd floor with lift, including a living room opening onto a terrace, a fitted fitted kitchen area, a hallway, 2 bedrooms with fitted wardrobes, shower room, wc, gas heater, 2 covered parking spaces. ",725,3,0,0,0,1,0,0,1,1,0,0,0,0
98,apartment,3,2,70,0,no,html/img/houses/98.JPG,"We offer a two-bedroom apartment, located on the ground floor, comprising: an entrance with cupboard, a living room opening onto a balcony, a fully equipped kitchen, two bedrooms, one of which has a cupboard, a bathroom and a WC. ",790,3,0,0,1,0,0,0,1,0,0,0,0,0
99,apartment,3,1,63,3,no,html/img/houses/99.JPG,"2 steps from the metro and shops, bright entirely on parquet floor comprising entrance hall, living room, living room with balcony, fitted, separate fitted kitchen, 2 bedrooms + cupboards, bathroom. cellar. collective heating, hot water. ",715,3,0,1,0,0,1,1,1,0,0,0,0,0
100,apartment,4,1,73,3,no,html/img/houses/100.JPG,"In a green, booming area, beautiful spacious one-bedroom apartment with large living room opening onto a large south-facing terrace. Fitted kitchen, 2 bedrooms, bathroom, wc, cellar, garage. ",895,3,0,0,0,0,0,1,1,1,0,1,0,0
101,apartment,2,1,28,2,yes,html/img/houses/101.JPG,"10 minutes from the center of Rennes, a furnished and refurbished apartment which consists of a bright living room with open furnished and equipped kitchen (hood, hob, microwave, washing machine) a bathroom with separate wc and a bedroom.",560,3,1,1,1,1,1,0,0,0,0,0,0,0
102,studio,1,1,19,3,yes,html/img/houses/102.JPG,"Near the city center and the faculty of law, in a small collective, on the top floor, apartment with a floor area of ​​30 m² recently renovated and comprising entrance hall, living room, equipped kitchenette, bathroom.",435,2,1,1,1,1,1,0,0,0,0,0,0,0
103,studio,1,1,23,1,no,html/img/houses/103.JPG,"2 steps from the beaulieu campus, pleasant studio including a living room, an equipped kitchen, a bathroom, a dressing room, a cellar and an outdoor parking space; all the comforts to succeed in your studies in a calm environment.",415,2,0,1,1,0,1,1,0,1,0,0,0,0
104,apartment,2,1,52,4,no,html/img/houses/104.JPG,"Located in the pottery district, a pleasant renovated type 3 apartment with parquet floor comprising entrance hall with cupboard, bright living room, fitted kitchen, 2 bedrooms, shower room and a cellar.",670,3,0,0,0,1,0,1,0,0,0,0,0,0
105,apartment,3,1,55,0,no,html/img/houses/105.JPG,"It includes an entrance, a living room, a fitted and equipped kitchen (hood, plates), two bedrooms, a shower room with WC. Cellar, attic, bike room.",716,3,0,0,1,0,0,1,0,0,0,0,0,0
106,studio,1,1,23,3,no,html/img/houses/106.JPG,"Located Quai de la Prévalaye, in a quiet and secure condominium on the edge of the Vilaine, 23m² studio on the 3rd and last floor without lift comprising a living room with kitchenette area and storage cupboard. Bathroom with bath and washing machine, separate WC.",457,2,0,1,0,0,1,0,0,0,0,0,0,0
107,apartment,3,1,57,2,no,html/img/houses/106.JPG,"In a recent luxury residence, a 3-room apartment of 57.24 m². It includes a living room with a fitted and equipped kitchen area, a loggia, two bedrooms, one of which has a loggia, a bathroom, a toilet with washbasin.",790,3,0,0,1,1,0,0,0,0,0,0,0,0
108,studio,1,1,27,1,no,html/img/houses/108.JPG,"On the 1st floor of a small condominium, studio, 27 m², living room facing south, fitted and equipped kitchen area (hob, fridge), bathroom with WC. Electric heating. Private outdoor parking.",480,2,0,0,1,0,0,0,0,1,0,0,0,0
109,apartment,3,1,65,1,no,html/img/houses/109.JPG,"Available immediately Located near the Jacques Cartier metro station, discover this crossing apartment composed of an entrance, a kitchen with balcony, a living room with balcony, two bedrooms, a bathroom and separate wc. You also benefit from a cellar and a garage.",700,3,0,1,0,0,1,1,1,1,0,0,0,0
110,apartment,3,1,56,3,no,html/img/houses/110.JPG,"Recent luxury residence, located in the Beaulieu Baud district. Located on the 3rd floor, this beautiful apartment of 60.65 m² consists of an entrance hall with cupboard, a living room opening onto a fitted kitchen area (storage furniture, hob, extractor) and extended by a terrace of 17.3 m². You will also enjoy 2 bedrooms and a bathroom with sink and heated towel rail. Individual gas heating. A garage and a private parking space complete this property. ",758,3,0,0,0,1,0,0,1,1,0,0,0,0
111,apartment,2,1,36,1,no,html/img/houses/111.JPG,"Recent one-bedroom apartment of 36.5 m², located on the 1st floor of a luxury building. Bright living room opening onto a small balcony, separate fitted kitchen, 1 bedroom and a shower room with WC. Private parking space in the basement.",675,3,0,0,0,1,0,0,1,1,0,0,0,0
112,apartment,2,1,68,8,no,html/img/houses/112.JPG,"Spacious Type 2 of 68 m2 on the 8th floor with lift comprising an entrance hall with cupboard, a fitted/equipped kitchen (hob and oven), a south-facing living room with a south-facing balcony, a bedroom, a bathroom and a toilet.",820,3,0,0,1,0,0,0,1,0,0,0,0,0
113,apartment,3,1,62,1,yes,html/img/houses/113.JPG,"Type three apartment with a living area of ​​61.50 M² located on the 1st floor with elevator comprising: entrance hall, living room opening onto balcony, kitchen, two bedrooms, wc, bathroom, terrace of 10.60 M² Individual electric heating.",750,3,1,0,0,0,0,0,1,0,0,0,0,0
114,apartment,4,2,88,3,no,html/img/houses/114.JPG,"Type 4 apartment in a beautiful old building completely renovated located on the 3rd and last floor without lift comprising: entrance-hallway, two bedrooms with parquet floors, a living room-living room facing south on parquet floors, a separate fitted kitchen and equipped with a hood and an induction hob, a toilet with washbasin, a shower room - a bathroom. ",1340,3,0,0,1,1,0,0,0,0,0,0,0,0
115,studio,1,1,20,2,no,html/img/houses/115.JPG,"Near the University of Rennes 1 and close to public transport. We offer this studio consisting of a living room with cupboard, an equipped kitchenette and a bathroom. You also have access to the parking lot of the residence and to the laundry. ",405,2,0,1,1,0,1,0,0,1,0,0,0,1
116,apartment,2,1,48,1,yes,html/img/houses/116.JPG,"We offer this large two-room apartment, consisting of a living room with balcony, a fitted kitchen and a bedroom with balcony. You also benefit from parking .",630,3,1,0,0,0,0,0,1,1,0,0,0,0
117,apartment,2,1,46,2,no,html/img/houses/117.JPG," Discover this recent apartment composed of a large bright living room opening onto a large balcony, a fitted and equipped open kitchen, a bedroom and a bathroom with wc. Also benefit from an indoor parking space.",560,3,0,0,1,1,0,0,1,1,0,0,0,0
118,studio,1,1,36,0,yes,html/img/houses/118.JPG," 10 minutes walk from the city center, 5 min by bus from Beaulieu, spacious furnished studio with fitted and equipped kitchen, washing machine, living room with dining area, living room, sleeping area, bathroom.",565,2,1,1,1,0,1,0,0,0,0,0,0,0
119,apartment,3,1,53,2,no,html/img/houses/119.JPG,"Rue St-Martin, 10 min walk from the Sainte-Anne metro station, 3-room apartment comprising an entrance hall with storage, large living room and dining room opening onto a balcony, separate kitchen, bedroom, shower room, WC and collective parking. ",750,3,0,1,0,0,1,0,1,1,0,0,0,0
120,studio,1,1,21,4,yes,html/img/houses/120.JPG,"Ideally located in the center of rennes and at the same time quiet, come and discover this furnished studio offering the charm of the old and the comfort of a recent renovation with 1 living room and open fitted kitchen, shower room . ",522,2,1,1,0,0,1,0,0,0,0,0,0,0
