,Unnamed: 0,id,type,rooms,bathrooms,squaremeters,floor,furnished,image,description,price,typenum,furnishednum,transport,equipped,renovated,shops,cellar,balcony,parking,shared,green,historic,university
36,94,107,apartment,3,1,57,2,no,html/img/houses/106.JPG,"In a recent luxury residence, a 3-room apartment of 57.24 m². It includes a living room with a fitted and equipped kitchen area, a loggia, two bedrooms, one of which has a loggia, a bathroom, a toilet with washbasin.",790,3,0,0,1,1,0,0,0,0,0,0,0,0
27,78,86,apartment,3,1,70,2,yes,html/img/houses/86.JPG,"Apartment located on the 2nd floor of a 1998 building, comprising an entrance hall, a living room opening onto a south-west facing terrace, a fitted and equipped kitchen, a utility room, 2 bedrooms, one with a closet, a bathroom and a separate WC. Individual heating (recent radiators), PVC double glazing, bicycle storage and fiber optics. Cellar and private parking in the secure basement. ",850,3,1,0,1,0,0,1,1,1,0,0,0,0
74,186,201,apartment,5,1,91,0,yes,html/img/houses/201.JPG,"Located near the Villejean metro station, UNIVERSITE RENNES 2, buses and shops. Come and discover this beautiful furnished type 5 apartment on the raised ground floor in a 1960s building. It offers you an entrance hall, a fitted and equipped kitchen (hood, hob, oven, microwave, dishwasher, fridge, washing machine) and a living room. In the sleeping area, you will find a hallway with cupboard, 4 bedrooms (TV, wardrobe, single bed and desk) and a bathroom.",1770,3,1,1,1,0,1,0,0,0,0,0,0,0
16,49,53,studio,1,1,14,1,yes,html/img/houses/52.JPG,"Furnished studio, sunny, in good condition, double glazing, close to amenities, STAR bus, Faculty of Law, Beaulieu Campus.",350,2,1,1,0,0,1,0,0,0,0,0,0,0
39,98,111,apartment,2,1,36,1,no,html/img/houses/111.JPG,"Recent one-bedroom apartment of 36.5 m², located on the 1st floor of a luxury building. Bright living room opening onto a small balcony, separate fitted kitchen, 1 bedroom and a shower room with WC. Private parking space in the basement.",675,3,0,0,0,1,0,0,1,1,0,0,0,0
71,180,195,apartment,8,2,114,2,no,html/img/houses/195.JPG,"Rennes Voltaire, renovated T8 house of approximately 114m², comprising on the ground floor, a living room with stove, a fitted kitchen, a laundry room, a toilet, on the 1st level: 4 bedrooms, 1 with private shower room, cupboards , bathroom, wc, office and on the 2nd level, a relaxation-leisure area of ​​approx. 46 m². Veranda, enclosed garden of around 250 m², garage, electric heating.",1815,3,0,0,0,0,0,0,1,1,0,1,0,0
1,6,6,apartment,1,1,25,1,no,html/img/houses/6.jpg,"Type 1 of 25 m² on the 1st floor, entrance with cupboard, Living room, Equipped kitchen, bathroom with c wc, Parking",450,3,0,0,1,0,0,0,0,1,0,0,0,0
20,55,59,studio,1,1,12,3,no,html/img/houses/59.JPG,"Close to the city center, quick access to the ring roads. Quiet studio under the roof. Located in a small building, apartment comprising a main room with kitchenette, bathroom and parking space. ",329,2,0,1,0,0,1,0,0,1,0,0,0,0
38,96,109,apartment,3,1,65,1,no,html/img/houses/109.JPG,"Available immediately Located near the Jacques Cartier metro station, discover this crossing apartment composed of an entrance, a kitchen with balcony, a living room with balcony, two bedrooms, a bathroom and separate wc. You also benefit from a cellar and a garage.",700,3,0,1,0,0,1,1,1,1,0,0,0,0
61,157,171,studio,1,1,20,0,no,html/img/houses/171.JPG,"20m² studio, located near the Faculty of Law on the ground floor, it includes a living room, a fitted and equipped kitchen (hob, fridge, extractor), a bathroom with wc.",430,2,0,1,1,0,1,0,0,0,0,0,0,0
63,159,173,apartment,4,1,107,1,no,html/img/houses/173.JPG,"Very beautiful furnished apartment of 107 m² located on the first floor of a quiet condominium close to shops and transport. It consists of a corridor leading to a living room, two beautiful bedrooms, an office, a fitted and equipped kitchen, a bathroom, a WC and a storeroom.",1300,3,0,1,1,0,1,1,0,0,0,0,0,0
30,84,96,apartment,3,1,58,2,no,html/img/houses/96.JPG,"In recent residence, Type 3 of 58 m² on the 2nd floor with lift, including a living room opening onto a terrace, a fitted fitted kitchen area, a hallway, 2 bedrooms with fitted wardrobes, shower room, wc, gas heater, 2 covered parking spaces. ",725,3,0,0,0,1,0,0,1,1,0,0,0,0
55,145,158,apartment,3,1,62,4,yes,html/img/houses/158.JPG,"In the heart of the historic center, in a character building, type 3 duplex apartment renovated with fitted and equipped kitchen, entrance, living room with kitchen, 2 bedrooms, bathroom, wc. ",985,3,1,0,1,1,0,0,0,0,0,0,1,0
22,59,63,apartment,4,1,92,14,no,html/img/houses/63.JPG,"With a panoramic view of the historic center, discover this bright apartment comprising an entrance hall with cupboard, a living room with balcony, a fitted and equipped kitchen with loggia, two bedrooms, a dressing room, a bathroom and separate wc. ",1300,3,0,1,1,0,1,0,1,0,0,0,0,0
26,69,75,apartment,3,1,85,3,no,html/img/houses/75.JPG,"Spacious type 3 inverted duplex of 85 m2 on the 3rd floor with elevator comprising an entrance with cupboard, 2 bedrooms, one with cupboard and terrace, shower room with wc, on the upstairs very nice living room / lounge on large West facing terrace, fitted and equipped open kitchen.",994,3,0,0,1,0,0,0,1,0,0,0,0,0
48,123,136,apartment,3,1,60,3,no,html/img/houses/136.JPG,"On the top floor, 3-room apartment of 60 m² including, living room on SOUTH balcony, fitted and equipped kitchen (hood + hob + oven), 2 bedrooms, bathroom, WC, loggia and plenty of storage . You also have a cellar and a private parking space. ",690,3,0,0,1,0,0,1,1,1,0,0,0,0
29,80,89,apartment,2,1,59,1,no,html/img/houses/89.JPG,"On the 1st floor of a charming condominium, we offer a furnished one-bedroom apartment with a surface area of ​​58m2 located at 4 bis Rue la Motte Picquet in RENNES and close to all amenities. It consists of an entrance, a fitted kitchen, a living room with fireplace, a bedroom with closet and a bathroom with WC and storage.",835,3,0,1,0,0,1,0,0,0,0,0,0,0
56,146,159,apartment,3,1,64,1,no,html/img/houses/159.JPG,"For rent, rue Pierre Roy, a type 3 apartment of 64.54 m² completely renovated in a quiet and green area near the Landry park comprising an entrance with cupboard, a fitted and equipped kitchen (ceramic hob and extractor), a stay on balcony, two rooms, a bathroom, a TOILET, a cellar and a garage. ",775,3,0,0,1,1,0,1,1,1,0,1,0,0
4,18,19,studio,1,1,14,-1,no,html/img/houses/19.jpg,"Studio of 14.48m² in a quiet area, close to the Faculty of Law, it includes a south facing living room opening onto a common courtyard, equipped kitchenette (hotplates, fridge, hood), a shower room with toilet. ",400,2,0,0,1,0,0,0,0,0,0,0,0,0
33,89,102,studio,1,1,19,3,yes,html/img/houses/102.JPG,"Near the city center and the faculty of law, in a small collective, on the top floor, apartment with a floor area of ​​30 m² recently renovated and comprising entrance hall, living room, equipped kitchenette, bathroom.",435,2,1,1,1,1,1,0,0,0,0,0,0,0
14,39,42,apartment,3,1,65,1,no,html/img/houses/42.JPG,"Located near the Jacques Cartier metro station, discover this crossing apartment composed of an entrance, a kitchen with balcony, a living room with balcony, two bedrooms, a bathroom and separate wc. You also benefit from a cellar and a garage.",700,3,0,1,0,0,1,1,1,1,0,0,0,0
34,92,105,apartment,3,1,55,0,no,html/img/houses/105.JPG,"It includes an entrance, a living room, a fitted and equipped kitchen (hood, plates), two bedrooms, a shower room with WC. Cellar, attic, bike room.",716,3,0,0,1,0,0,1,0,0,0,0,0,0
66,168,182,apartment,2,1,42,2,no,html/img/houses/182.JPG,"t2 composed of: an entrance with dressing room, living room, fitted kitchen, bedroom with storage and shower room. outdoor parking collective heating and hot water. ",545,3,0,0,0,0,0,0,0,1,0,0,0,0
44,110,123,apartment,2,1,39,3,yes,html/img/houses/123.JPG,"New secure residence located in RENNES close to all amenities. Ideal students or young professionals. Large and beautiful NEW T2 of 39.35 m² located on the 3rd floor with lift. It consists of a large living room opening onto an equipped kitchenette (sink, sink unit, hob, top fridge and storage units), a bedroom and a bathroom (shower, cabinet basin, mirror and WC). Heating and water included in the charges.",661,3,1,1,1,1,1,0,0,0,0,0,0,0
45,112,125,apartment,2,1,68,8,no,html/img/houses/125.JPG,"Town center, near Les Halles, Spacious Type 2 of 68 m2 on the 8th floor with lift comprising an entrance hall with cupboard, a fitted/equipped kitchen (hob and oven), a south-facing living room with a south-facing balcony, a bedroom, a bathroom and a toilet. Collective heating and cold water. Very nice open view. ",820,3,0,1,1,0,1,0,1,0,0,0,0,0
5,20,21,apartment,5,1,87,4,no,html/img/houses/21.jpg,"This apartment of 95 m² (about 1021 ft²), in a building of 4 floors comprises 4 rooms including 3 bedrooms, 1 bathroom and 1 toilet. Near the historic centre, shops and public transport. It is composed of an entrance, three bedrooms (North-West, South-East, South-West), one of which has a cupboard and another which can be used as an office. Living room with south-east exposure leading to a balcony with a clear view. Separate fitted kitchen, bathroom with new MAL outlet, separate WC. Two people sharing accepted. Cellar and garage.",1155,3,0,1,0,0,1,1,1,1,0,0,1,0
19,54,58,studio,1,1,28,2,no,html/img/houses/58.JPG,"In the heart of the Alphonse Guérin district on Avenue Sergent Maginot, this studio is located less than 50m from the C6 and C4 bus lines connecting the city center, Villejean and Beaulieu. Facing south with a view of the courtyard, we offer this renovated and very functional apartment comprising an entrance hall, a main room with a balcony, a kitchenette, a shower room. ",490,2,0,1,0,1,1,0,1,0,0,0,0,0
65,167,181,apartment,3,1,54,1,yes,html/img/houses/181.JPG,"Apartment Type T3 furnished and equipped, located in a pleasant and well located environment comprising living room, 2 bedrooms, fitted and equipped kitchen, bathroom water, separate wc, digicode, close to the Anatole France metro and all amenities. ",789,3,1,1,1,0,1,0,0,0,0,0,0,0
41,101,114,apartment,4,2,88,3,no,html/img/houses/114.JPG,"Type 4 apartment in a beautiful old building completely renovated located on the 3rd and last floor without lift comprising: entrance-hallway, two bedrooms with parquet floors, a living room-living room facing south on parquet floors, a separate fitted kitchen and equipped with a hood and an induction hob, a toilet with washbasin, a shower room - a bathroom. ",1340,3,0,0,1,1,0,0,0,0,0,0,0,0
37,95,108,studio,1,1,27,1,no,html/img/houses/108.JPG,"On the 1st floor of a small condominium, studio, 27 m², living room facing south, fitted and equipped kitchen area (hob, fridge), bathroom with WC. Electric heating. Private outdoor parking.",480,2,0,0,1,0,0,0,0,1,0,0,0,0
